{
  "config": {
    "configHash": "c6c4c570fa8ff13946dfa5986ab13185005da22a",
    "fixtureHash": "06bf211f89b87871ca02cb491e8fa6ebbdc1881f",
    "flow": "deep-realistic",
    "maxL1": 5,
    "maxL2": 5,
    "minL1": 3,
    "minL2": 2,
    "mode": "noisy-mixed",
    "notSureRate": 0.5,
    "profile": "uncertain",
    "seed": 555,
    "snapshotVersion": "1.2.0",
    "stopOnGates": true
  },
  "coverage": {
    "coverageFirstPicks": [
      {
        "cardId": "L1_social",
        "reason": "macro_specific_detached",
        "step": 0
      },
      {
        "cardId": "L1_energy",
        "reason": "macro_specific_detached",
        "step": 1
      },
      {
        "cardId": "L1_safety",
        "reason": "macro_specific_detached",
        "step": 2
      }
    ],
    "gateFirstHitStep": {
      "agency": 0,
      "arousal": 0,
      "clarity": 0,
      "social": 0,
      "valence": 0
    }
  },
  "events": [
    {
      "i": 0,
      "step": 0,
      "type": "session_start"
    },
    {
      "i": 1,
      "step": 0,
      "tags": [
        "sig.agency.mid",
        "sig.arousal.mid",
        "sig.clarity.low",
        "sig.fatigue.mid",
        "sig.social.mid",
        "sig.tension.mid",
        "sig.valence.neutral"
      ],
      "type": "baseline_injected"
    },
    {
      "i": 2,
      "step": 0,
      "tags": [
        "sig.agency.mid",
        "sig.arousal.mid",
        "sig.clarity.low",
        "sig.fatigue.mid",
        "sig.social.mid",
        "sig.tension.mid",
        "sig.valence.neutral"
      ],
      "type": "evidence_added"
    },
    {
      "gate": "valence",
      "i": 3,
      "scope": "any",
      "step": 0,
      "type": "gate_hit"
    },
    {
      "gate": "arousal",
      "i": 4,
      "scope": "any",
      "step": 0,
      "type": "gate_hit"
    },
    {
      "gate": "agency",
      "i": 5,
      "scope": "any",
      "step": 0,
      "type": "gate_hit"
    },
    {
      "gate": "clarity",
      "i": 6,
      "scope": "any",
      "step": 0,
      "type": "gate_hit"
    },
    {
      "gate": "social",
      "i": 7,
      "scope": "any",
      "step": 0,
      "type": "gate_hit"
    },
    {
      "cardId": "L1_social",
      "i": 8,
      "step": 0,
      "type": "card_shown"
    },
    {
      "cardId": "L1_social",
      "choice": "NS",
      "i": 9,
      "step": 0,
      "type": "answer_committed"
    },
    {
      "cardId": "L1_social",
      "i": 10,
      "step": 0,
      "tags": [
        "sig.axis.unknown",
        "sig.uncertainty.high"
      ],
      "type": "evidence_added"
    },
    {
      "i": 11,
      "micro": {
        "reason": "matched",
        "selected": "detached.autopilot",
        "source": "selected",
        "topCandidate": null
      },
      "step": 1,
      "type": "micro_selected"
    },
    {
      "cardId": "L1_energy",
      "i": 12,
      "step": 1,
      "type": "card_shown"
    },
    {
      "cardId": "L1_energy",
      "choice": "A",
      "i": 13,
      "step": 1,
      "type": "answer_committed"
    },
    {
      "cardId": "L1_energy",
      "i": 14,
      "step": 1,
      "tags": [
        "l1_energy_low",
        "sig.arousal.low",
        "sig.fatigue.high"
      ],
      "type": "evidence_added"
    },
    {
      "cardId": "L1_energy",
      "gate": "arousal",
      "i": 15,
      "scope": "cardsOnly",
      "step": 1,
      "type": "gate_hit"
    },
    {
      "i": 16,
      "micro": {
        "reason": "matched",
        "selected": "detached.autopilot",
        "source": "selected",
        "topCandidate": null
      },
      "step": 2,
      "type": "micro_selected"
    },
    {
      "cardId": "L1_safety",
      "i": 17,
      "step": 2,
      "type": "card_shown"
    },
    {
      "cardId": "L1_safety",
      "choice": "NS",
      "i": 18,
      "step": 2,
      "type": "answer_committed"
    },
    {
      "cardId": "L1_safety",
      "i": 19,
      "step": 2,
      "tags": [
        "sig.axis.unknown",
        "sig.uncertainty.high"
      ],
      "type": "evidence_added"
    },
    {
      "i": 20,
      "micro": {
        "reason": "matched",
        "selected": "detached.autopilot",
        "source": "selected",
        "topCandidate": null
      },
      "step": 3,
      "type": "micro_selected"
    },
    {
      "cardId": "L1_mood",
      "i": 21,
      "step": 3,
      "type": "card_shown"
    },
    {
      "cardId": "L1_mood",
      "choice": "A",
      "i": 22,
      "step": 3,
      "type": "answer_committed"
    },
    {
      "cardId": "L1_mood",
      "i": 23,
      "step": 3,
      "tags": [
        "l1_mood_neg",
        "sig.valence.neg"
      ],
      "type": "evidence_added"
    },
    {
      "cardId": "L1_mood",
      "gate": "valence",
      "i": 24,
      "scope": "cardsOnly",
      "step": 3,
      "type": "gate_hit"
    },
    {
      "i": 25,
      "micro": {
        "reason": "matched",
        "selected": "detached.autopilot",
        "source": "selected",
        "topCandidate": null
      },
      "step": 4,
      "type": "micro_selected"
    },
    {
      "cardId": "L1_body",
      "i": 26,
      "step": 4,
      "type": "card_shown"
    },
    {
      "cardId": "L1_body",
      "choice": "NS",
      "i": 27,
      "step": 4,
      "type": "answer_committed"
    },
    {
      "cardId": "L1_body",
      "i": 28,
      "step": 4,
      "tags": [
        "sig.axis.unknown",
        "sig.uncertainty.high"
      ],
      "type": "evidence_added"
    },
    {
      "i": 29,
      "micro": {
        "reason": "matched",
        "selected": "detached.autopilot",
        "source": "selected",
        "topCandidate": null
      },
      "step": 5,
      "type": "micro_selected"
    },
    {
      "cardId": "L2_numb",
      "i": 30,
      "step": 5,
      "type": "card_shown"
    },
    {
      "cardId": "L2_numb",
      "choice": "NS",
      "i": 31,
      "step": 5,
      "type": "answer_committed"
    },
    {
      "cardId": "L2_numb",
      "i": 32,
      "step": 5,
      "tags": [
        "sig.axis.unknown",
        "sig.uncertainty.high"
      ],
      "type": "evidence_added"
    },
    {
      "i": 33,
      "micro": {
        "reason": "matched",
        "selected": "detached.autopilot",
        "source": "selected",
        "topCandidate": null
      },
      "step": 6,
      "type": "micro_selected"
    },
    {
      "cardId": "L2_social_pain",
      "i": 34,
      "step": 6,
      "type": "card_shown"
    },
    {
      "cardId": "L2_social_pain",
      "choice": "B",
      "i": 35,
      "step": 6,
      "type": "answer_committed"
    },
    {
      "cardId": "L2_social_pain",
      "i": 36,
      "step": 6,
      "tags": [
        "l2_social_ok"
      ],
      "type": "evidence_added"
    },
    {
      "i": 37,
      "micro": {
        "reason": "matched",
        "selected": "detached.autopilot",
        "source": "selected",
        "topCandidate": null
      },
      "step": 7,
      "type": "micro_selected"
    },
    {
      "i": 38,
      "step": 7,
      "type": "expected_macro_computed"
    },
    {
      "endedReason": "l2_plan_completed",
      "i": 39,
      "step": 7,
      "type": "session_end"
    }
  ],
  "final": {
    "askedL1Count": 5,
    "askedL2Count": 2,
    "axisTagCount": 4,
    "baselineEvidenceTags": [
      "sig.agency.mid",
      "sig.arousal.mid",
      "sig.clarity.low",
      "sig.fatigue.mid",
      "sig.social.mid",
      "sig.tension.mid",
      "sig.valence.neutral"
    ],
    "cardEvidenceTags": [
      "l1_energy_low",
      "l1_mood_neg",
      "l2_social_ok",
      "sig.arousal.low",
      "sig.axis.unknown",
      "sig.fatigue.high",
      "sig.uncertainty.high",
      "sig.valence.neg"
    ],
    "eligibleForContradiction": true,
    "endedBy": "l2",
    "endedReason": "l2_plan_completed",
    "evidenceTags": [
      "l1_energy_low",
      "l1_mood_neg",
      "l2_social_ok",
      "sig.agency.mid",
      "sig.arousal.low",
      "sig.arousal.mid",
      "sig.axis.unknown",
      "sig.clarity.low",
      "sig.fatigue.high",
      "sig.fatigue.mid",
      "sig.social.mid",
      "sig.tension.mid",
      "sig.uncertainty.high",
      "sig.valence.neg",
      "sig.valence.neutral"
    ],
    "expectedMacro": "exhausted",
    "gatesHitAny": {
      "agency": true,
      "arousal": true,
      "clarity": true,
      "load": false,
      "social": true,
      "valence": true
    },
    "gatesHitCardsOnly": {
      "agency": false,
      "arousal": true,
      "clarity": false,
      "load": false,
      "social": false,
      "valence": true
    },
    "hasContradiction": false,
    "macroAfterL1": "detached",
    "macroAfterL2": "detached",
    "macroBeforeCards": "detached",
    "micro": {
      "reason": "matched",
      "selected": "detached.autopilot",
      "source": "selected",
      "topCandidate": null
    },
    "notSureCount": 4,
    "phase": "ENDED",
    "scoringTagCount": 21,
    "signalScore": -3,
    "topSignals": [
      "sig.valence.neg",
      "sig.fatigue.high"
    ]
  },
  "fixture": {
    "id": "GS09",
    "seed": 555
  }
}